Date,Problem Number,Problem Name,Problem Rating,Problem Link,Contest Name,Tags
"Dec. 15, 2024",3389,Minimum Operations to Mak…aracter Frequencies Equal,2934,https://leetcode.com/problems/minimum-operations-to-make-character-frequencies-equal/,Weekly Contest 428,"hash table, string, dynamic programming, counting, enumeration"
"July 7, 2024",3213,Construct String with Minimum Cost,2923,https://leetcode.com/problems/construct-string-with-minimum-cost/,Weekly Contest 405,"array, string, dynamic programming, suffix array"
"Jan. 28, 2024",3022,Minimize OR of Remaining Elements Using Operations,2945,https://leetcode.com/problems/minimize-or-of-remaining-elements-using-operations/,Weekly Contest 382,"array, greedy, bit manipulation"
"Nov. 25, 2023",2945,Find Maximum Non-decreasing Array Length,2954,https://leetcode.com/problems/find-maximum-non-decreasing-array-length/,Biweekly Contest 118,"array, binary search, dynamic programming, stack, queue, monotonic stack, monotonic queue"
"May 21, 2023",2699,Modify Graph Edge Weights,2911,https://leetcode.com/problems/modify-graph-edge-weights/,Weekly Contest 346,"graph, heap (priority queue), shortest path"
"Aug. 22, 2021",1982,Find Array Given Subset Sums,2921,https://leetcode.com/problems/find-array-given-subset-sums/,Weekly Contest 255,"array, divide and conquer"
"Jan. 21, 2018",770,Basic Calculator IV,2955,https://leetcode.com/problems/basic-calculator-iv/,Weekly Contest 68,"hash table, string, stack, math, recursion"
