Date,Problem Number,Problem Name,Problem Rating,Problem Link,Contest Name,Tags
"Aug. 18, 2025",3656,Determine if a Simple Graph Exists,1921.0,https://leetcode.com/problems/determine-if-a-simple-graph-exists/,,
"Aug. 16, 2025",3647,Maximum Weight in Two Bags,1908.0,https://leetcode.com/problems/maximum-weight-in-two-bags/,,
"July 28, 2025",3631,Sort Threats by Severity and Exploitability,1905.0,https://leetcode.com/problems/sort-threats-by-severity-and-exploitability/,,
"July 14, 2025",3616,Number of Student Replacements,1973.0,https://leetcode.com/problems/number-of-student-replacements/,,
"July 13, 2025",3614,Process String with Special Operations II,1974.0,https://leetcode.com/problems/process-string-with-special-operations-ii/,Weekly Contest 458,"simulation, string"
"June 23, 2025",3595,Once Twice,1984.0,https://leetcode.com/problems/once-twice/,,"array, bit manipulation"
"June 22, 2025",3593,Minimum Increments to Equalize Leaf Paths,1939.0,https://leetcode.com/problems/minimum-increments-to-equalize-leaf-paths/,Weekly Contest 455,"array, depth-first search, dynamic programming, tree"
"June 8, 2025",3580,Find Consistently Improving Employees,1971.0,https://leetcode.com/problems/find-consistently-improving-employees/,,database
"June 8, 2025",3578,Count Partitions With Max-Min Difference at Most K,1957.0,https://leetcode.com/problems/count-partitions-with-max-min-difference-at-most-k/,Weekly Contest 453,"array, dynamic programming, monotonic queue, prefix sum, queue, sliding window"
"May 25, 2025",3564,Seasonal Sales Analysis,1956.0,https://leetcode.com/problems/seasonal-sales-analysis/,,database
yesterday,3555,Smallest Subarray to Sort in Every Sliding Window,1994.0,https://leetcode.com/problems/smallest-subarray-to-sort-in-every-sliding-window/,,
"April 20, 2025",3524,Find X Value of Array I,1976.0,https://leetcode.com/problems/find-x-value-of-array-i/,Weekly Contest 446,
"April 17, 2025",3521,Find Product Recommendation Pairs,1971.0,https://leetcode.com/problems/find-product-recommendation-pairs/,,database
"March 28, 2025",3497,Analyze Subscription Conversion,1941.0,https://leetcode.com/problems/analyze-subscription-conversion/,,database
"March 24, 2025",3496,Maximize Score After Pair Deletions,1933.0,https://leetcode.com/problems/maximize-score-after-pair-deletions/,,"array, greedy"
"March 11, 2025",3481,Apply Substitutions,1978.0,https://leetcode.com/problems/apply-substitutions/,,
"March 4, 2025",3476,Maximize Profit from Task Assignment,1933.0,https://leetcode.com/problems/maximize-profit-from-task-assignment/,,"array, greedy, heap (priority queue), sorting"
"March 3, 2025",3475,DNA Pattern Recognition,1927.0,https://leetcode.com/problems/dna-pattern-recognition/,,database
"Feb. 25, 2025",3466,Maximum Coin Collection,1929.0,https://leetcode.com/problems/maximum-coin-collection/,,
"Feb. 17, 2025",3460,Longest Common Prefix After at Most One Removal,1904.0,https://leetcode.com/problems/longest-common-prefix-after-at-most-one-removal/,,"string, two pointers"
"Jan. 31, 2025",3437,Permutations III,1978.0,https://leetcode.com/problems/permutations-iii/,,"array, backtracking"
"Jan. 23, 2025",3431,Minimum Unlocked Indices to Sort Nums,1921.0,https://leetcode.com/problems/minimum-unlocked-indices-to-sort-nums/,,"array, hash table"
"Dec. 27, 2024",3400,Maximum Number of Matching I…ndices After Right Shifts,1978.0,https://leetcode.com/problems/maximum-number-of-matching-indices-after-right-shifts/,,"array, simulation, two pointers"
"Dec. 21, 2024",3394,Check if Grid can be Cut into Sections,1905.0,https://leetcode.com/problems/check-if-grid-can-be-cut-into-sections/,Biweekly Contest 146,
"Dec. 20, 2024",3391,Design a 3D Binary Matrix with …Efficient Layer Tracking,1904.0,https://leetcode.com/problems/design-a-3d-binary-matrix-with-efficient-layer-tracking/,,"array, design, hash table, heap (priority queue), matrix, ordered set"
"Dec. 8, 2024",3381,Maximum Subarray Sum With Length Divisible by K,1933.0,https://leetcode.com/problems/maximum-subarray-sum-with-length-divisible-by-k/,Weekly Contest 427,"array, hash table, prefix sum"
"Oct. 31, 2024",3339,Find the Number of K-Even Arrays,1996.0,https://leetcode.com/problems/find-the-number-of-k-even-arrays/,,dynamic programming
"Oct. 21, 2024",3328,Find Cities in Each State II,1908.0,https://leetcode.com/problems/find-cities-in-each-state-ii/,,database
"Oct. 13, 2024",3322,Premier League Table Ranking III,1910.0,https://leetcode.com/problems/premier-league-table-ranking-iii/,,database
"Sept. 18, 2024",3294,Convert Doubly Linked List to Array II,1966.0,https://leetcode.com/problems/convert-doubly-linked-list-to-array-ii/,,"array, doubly-linked list, linked list"
"Aug. 20, 2024",3262,Find Overlapping Shifts,1933.0,https://leetcode.com/problems/find-overlapping-shifts/,,database
"Aug. 16, 2024",3253,Construct String with Minimum Cost (Easy),1917.0,https://leetcode.com/problems/construct-string-with-minimum-cost-easy/,,
"Aug. 14, 2024",3252,Premier League Table Ranking II,1932.0,https://leetcode.com/problems/premier-league-table-ranking-ii/,,database
"July 20, 2024",3224,Minimum Array Changes to Make Differences Equal,1988.0,https://leetcode.com/problems/minimum-array-changes-to-make-differences-equal/,Biweekly Contest 135,"array, hash table, prefix sum"
"July 14, 2024",3215,Count Triplets with Even XOR Set Bits II,1917.0,https://leetcode.com/problems/count-triplets-with-even-xor-set-bits-ii/,,"array, bit manipulation"
"July 6, 2024",3205,Maximum Array Hopping Score I,1998.0,https://leetcode.com/problems/maximum-array-hopping-score-i/,,"array, dynamic programming, greedy, monotonic stack, stack"
"July 6, 2024",3204,Bitwise User Permissions Analysis,1973.0,https://leetcode.com/problems/bitwise-user-permissions-analysis/,,database
"June 30, 2024",3202,Find the Maximum Length of Valid Subsequence II,1929.0,https://leetcode.com/problems/find-the-maximum-length-of-valid-subsequence-ii/,Weekly Contest 404,"array, dynamic programming"
"May 25, 2024",3157,Find the Level of Tree with Minimum Sum,1904.0,https://leetcode.com/problems/find-the-level-of-tree-with-minimum-sum/,,"binary tree, breadth-first search, depth-first search, tree"
"May 11, 2024",3140,Consecutive Available Seats II,1917.0,https://leetcode.com/problems/consecutive-available-seats-ii/,,database
"May 5, 2024",3138,Minimum Length of Anagram Concatenation,1973.0,https://leetcode.com/problems/minimum-length-of-anagram-concatenation/,Weekly Contest 396,"counting, hash table, string"
"April 28, 2024",3133,Minimum Array End,1932.0,https://leetcode.com/problems/minimum-array-end/,Weekly Contest 395,bit manipulation
"April 27, 2024",3125,Maximum Number That Makes R…esult of Bitwise AND Zero,1904.0,https://leetcode.com/problems/maximum-number-that-makes-result-of-bitwise-and-zero/,,"greedy, sorting, string"
"April 27, 2024",3124,Find Longest Calls,1929.0,https://leetcode.com/problems/find-longest-calls/,,database
"April 21, 2024",3122,Minimum Number of Operations to Satisfy Conditions,1900.0,https://leetcode.com/problems/minimum-number-of-operations-to-satisfy-conditions/,Weekly Contest 394,"array, dynamic programming, matrix"
"March 30, 2024",3094,Guess the Number Using Bitwise Questions II,1970.0,https://leetcode.com/problems/guess-the-number-using-bitwise-questions-ii/,,"bit manipulation, interactive"
"March 24, 2024",3087,Find Trending Hashtags,1929.0,https://leetcode.com/problems/find-trending-hashtags/,,database
"March 16, 2024",3081,Replace Question Marks in Str…ing to Minimize Its Value,1911.0,https://leetcode.com/problems/replace-question-marks-in-string-to-minimize-its-value/,Biweekly Contest 126,"counting, greedy, hash table, heap (priority queue), sorting, string"
"March 16, 2024",3078,Match Alphanumerical Pattern in Matrix I,1937.0,https://leetcode.com/problems/match-alphanumerical-pattern-in-matrix-i/,,"array, hash table, matrix, string"
"March 2, 2024",3067,Count Pairs of Connectable Servers i…n a Weighted Tree Network,1929.0,https://leetcode.com/problems/count-pairs-of-connectable-servers-in-a-weighted-tree-network/,Biweekly Contest 125,"array, depth-first search, tree"
"March 2, 2024",3064,Guess the Number Using Bitwise Questions I,1964.0,https://leetcode.com/problems/guess-the-number-using-bitwise-questions-i/,,"bit manipulation, interactive"
"March 2, 2024",3056,Snaps Analysis,1913.0,https://leetcode.com/problems/snaps-analysis/,,database
"March 2, 2024",3055,Top Percentile Fraud,1921.0,https://leetcode.com/problems/top-percentile-fraud/,,database
"March 2, 2024",3054,Binary Tree Nodes,1970.0,https://leetcode.com/problems/binary-tree-nodes/,,database
"March 2, 2024",3050,Pizza Toppings Cost Analysis,1901.0,https://leetcode.com/problems/pizza-toppings-cost-analysis/,,database
"Feb. 11, 2024",3036,Number of Subarrays That Match a Pattern II,1901.0,https://leetcode.com/problems/number-of-subarrays-that-match-a-pattern-ii/,Weekly Contest 384,"array, hash function, rolling hash, string matching"
"Feb. 3, 2024",3023,Find Pattern in Infinite Stream I,1995.0,https://leetcode.com/problems/find-pattern-in-infinite-stream-i/,,"array, hash function, rolling hash, sliding window, string matching"
"Jan. 6, 2024",2993,Friday Purchases I,1969.0,https://leetcode.com/problems/friday-purchases-i/,,database
"Jan. 6, 2024",2992,Number of Self-Divisible Permutations,1908.0,https://leetcode.com/problems/number-of-self-divisible-permutations/,,"array, backtracking, bit manipulation, bitmask, dynamic programming"
"Jan. 6, 2024",2989,Class Performance,1968.0,https://leetcode.com/problems/class-performance/,,database
"Jan. 6, 2024",2988,Manager of the Largest Department,1965.0,https://leetcode.com/problems/manager-of-the-largest-department/,,database
"Jan. 6, 2024",2984,Find Peak Calling Hours for Each City,1916.0,https://leetcode.com/problems/find-peak-calling-hours-for-each-city/,,database
"Dec. 10, 2023",2963,Count the Number of Good Partitions,1988.0,https://leetcode.com/problems/count-the-number-of-good-partitions/,Weekly Contest 375,"array, combinatorics, hash table, math"
"Nov. 19, 2023",2936,Number of Equal Numbers Blocks,1923.0,https://leetcode.com/problems/number-of-equal-numbers-blocks/,,"array, binary search, interactive"
"Nov. 5, 2023",2925,Maximum Score After Applying Operations on a Tree,1938.0,https://leetcode.com/problems/maximum-score-after-applying-operations-on-a-tree/,Weekly Contest 370,"depth-first search, dynamic programming, tree"
"Oct. 14, 2023",2898,Maximum Linear Stock Score,1904.0,https://leetcode.com/problems/maximum-linear-stock-score/,,"array, hash table"
"Oct. 1, 2023",2875,Minimum Size Subarray in Infinite Array,1908.0,https://leetcode.com/problems/minimum-size-subarray-in-infinite-array/,Weekly Contest 365,"array, hash table, prefix sum, sliding window"
"Sept. 30, 2023",2872,Maximum Number of K-Divisible Components,1970.0,https://leetcode.com/problems/maximum-number-of-k-divisible-components/,Biweekly Contest 114,"depth-first search, tree"
"Sept. 17, 2023",2861,Maximum Number of Alloys,1973.0,https://leetcode.com/problems/maximum-number-of-alloys/,Weekly Contest 363,"array, binary search"
"Sept. 10, 2023",2850,Minimum Moves to Spread Stones Over Grid,1988.0,https://leetcode.com/problems/minimum-moves-to-spread-stones-over-grid/,Weekly Contest 362,"array, breadth-first search, dynamic programming, matrix"
"Aug. 20, 2023",2831,Find the Longest Equal Subarray,1977.0,https://leetcode.com/problems/find-the-longest-equal-subarray/,Weekly Contest 359,"array, binary search, hash table, sliding window"
"Aug. 5, 2023",2805,Custom Interval,1961.0,https://leetcode.com/problems/custom-interval/,,javascript
"July 30, 2023",2795,Parallel Execution of Promises for Ind…ividual Results Retrieval,1927.0,https://leetcode.com/problems/parallel-execution-of-promises-for-individual-results-retrieval/,,javascript
"July 22, 2023",2782,Number of Unique Categories,1971.0,https://leetcode.com/problems/number-of-unique-categories/,,"counting, interactive, union find"
"July 16, 2023",2777,Date Range Generator,1953.0,https://leetcode.com/problems/date-range-generator/,,javascript
"July 16, 2023",2776,Convert Callback Based Function …to Promise Based Function,1923.0,https://leetcode.com/problems/convert-callback-based-function-to-promise-based-function/,,javascript
"July 2, 2023",2762,Continuous Subarrays,1933.0,https://leetcode.com/problems/continuous-subarrays/,Weekly Contest 352,"array, heap (priority queue), monotonic queue, ordered set, queue, sliding window"
"July 2, 2023",2755,Deep Merge of Two Objects,1916.0,https://leetcode.com/problems/deep-merge-of-two-objects/,,javascript
"July 2, 2023",2754,Bind Function to Context,1989.0,https://leetcode.com/problems/bind-function-to-context/,,javascript
"June 18, 2023",2737,Find the Closest Marked Node,1983.0,https://leetcode.com/problems/find-the-closest-marked-node/,,"array, graph, heap (priority queue), shortest path"
"June 10, 2023",2731,Movement of Robots,1934.0,https://leetcode.com/problems/movement-of-robots/,Biweekly Contest 106,"array, brainteaser, prefix sum, sorting"
"May 21, 2023",2692,Make Object Immutable,1925.0,https://leetcode.com/problems/make-object-immutable/,,javascript
"May 13, 2023",2680,Maximum OR,1915.0,https://leetcode.com/problems/maximum-or/,Biweekly Contest 104,"array, bit manipulation, greedy, prefix sum"
"May 7, 2023",2673,Make Costs of Paths Equal in a Binary Tree,1920.0,https://leetcode.com/problems/make-costs-of-paths-equal-in-a-binary-tree/,Weekly Contest 344,"array, binary tree, dynamic programming, greedy, tree"
"April 29, 2023",2655,Find Maximal Uncovered Ranges,1987.0,https://leetcode.com/problems/find-maximal-uncovered-ranges/,,"array, sorting"
"April 23, 2023",2654,Minimum Number of Operations to Make All …Array Elements Equal to 1,1936.0,https://leetcode.com/problems/minimum-number-of-operations-to-make-all-array-elements-equal-to-1/,Weekly Contest 342,"array, math, number theory"
"April 15, 2023",2638,Count the Number of K-Free Subsets,1980.0,https://leetcode.com/problems/count-the-number-of-k-free-subsets/,,"array, combinatorics, dynamic programming, math, sorting"
"April 1, 2023",2608,Shortest Cycle in a Graph,1926.0,https://leetcode.com/problems/shortest-cycle-in-a-graph/,Biweekly Contest 101,"breadth-first search, graph"
"March 5, 2023",2585,Number of Ways to Earn Points,1930.0,https://leetcode.com/problems/number-of-ways-to-earn-points/,Weekly Contest 335,"array, dynamic programming"
"Feb. 12, 2023",2564,Substring XOR Queries,1954.0,https://leetcode.com/problems/substring-xor-queries/,Weekly Contest 332,"array, bit manipulation, hash table, string"
"Jan. 21, 2023",2539,Count the Number of Good Subsequences,1922.0,https://leetcode.com/problems/count-the-number-of-good-subsequences/,,"combinatorics, counting, hash table, math, string"
"Jan. 15, 2023",2534,Time Taken to Cross the Door,1959.0,https://leetcode.com/problems/time-taken-to-cross-the-door/,,"array, queue, simulation"
"Dec. 25, 2022",2516,Take K of Each Character From Left and Right,1923.0,https://leetcode.com/problems/take-k-of-each-character-from-left-and-right/,Weekly Contest 325,"hash table, sliding window, string"
"Dec. 18, 2022",2509,Cycle Length Queries in a Tree,1934.0,https://leetcode.com/problems/cycle-length-queries-in-a-tree/,Weekly Contest 324,"array, binary tree, tree"
"Dec. 4, 2022",2489,Number of Substrings With Fixed Ratio,1971.0,https://leetcode.com/problems/number-of-substrings-with-fixed-ratio/,,"hash table, math, prefix sum, string"
"Oct. 15, 2022",2439,Minimize Maximum of Array,1929.0,https://leetcode.com/problems/minimize-maximum-of-array/,Biweekly Contest 89,"array, binary search, dynamic programming, greedy, prefix sum"
"Oct. 9, 2022",2435,Paths in Matrix Whose Sum Is Divisible by K,1953.0,https://leetcode.com/problems/paths-in-matrix-whose-sum-is-divisible-by-k/,Weekly Contest 314,"array, dynamic programming, matrix"
"Oct. 9, 2022",2434,Using a Robot to Print the Lexicogr…aphically Smallest String,1958.0,https://leetcode.com/problems/using-a-robot-to-print-the-lexicographically-smallest-string/,Weekly Contest 314,"greedy, hash table, stack, string"
"Sept. 17, 2022",2411,Smallest Subarrays With Maximum Bitwise OR,1910.0,https://leetcode.com/problems/smallest-subarrays-with-maximum-bitwise-or/,Biweekly Contest 87,"array, binary search, bit manipulation, sliding window"
"Sept. 3, 2022",2398,Maximum Number of Robots Within Budget,1939.0,https://leetcode.com/problems/maximum-number-of-robots-within-budget/,Biweekly Contest 86,"array, binary search, heap (priority queue), prefix sum, queue, sliding window"
"Aug. 28, 2022",2392,Build a Matrix With Conditions,1961.0,https://leetcode.com/problems/build-a-matrix-with-conditions/,Weekly Contest 308,"array, graph, matrix, topological sort"
"July 31, 2022",2360,Longest Cycle in a Graph,1907.0,https://leetcode.com/problems/longest-cycle-in-a-graph/,Weekly Contest 304,"depth-first search, graph, topological sort"
"July 23, 2022",2350,Shortest Impossible Sequence of Rolls,1953.0,https://leetcode.com/problems/shortest-impossible-sequence-of-rolls/,Biweekly Contest 83,"array, greedy, hash table"
"June 11, 2022",2297,Jump Game VIII,1936.0,https://leetcode.com/problems/jump-game-viii/,,"array, dynamic programming, graph, monotonic stack, shortest path, stack"
"June 5, 2022",2296,Design a Text Editor,1943.0,https://leetcode.com/problems/design-a-text-editor/,Weekly Contest 296,"design, doubly-linked list, linked list, simulation, stack, string"
"May 28, 2022",2282,Number of People That Can Be Seen in a Grid,1995.0,https://leetcode.com/problems/number-of-people-that-can-be-seen-in-a-grid/,,"array, matrix, monotonic stack, stack"
"April 24, 2022",2250,Count Number of Rectangles Containing Each Point,1999.0,https://leetcode.com/problems/count-number-of-rectangles-containing-each-point/,Weekly Contest 290,"array, binary indexed tree, binary search, sorting"
"April 3, 2022",2227,Encrypt and Decrypt Strings,1953.0,https://leetcode.com/problems/encrypt-and-decrypt-strings/,Weekly Contest 287,"array, design, hash table, string, trie"
"March 13, 2022",2198,Number of Single Divisor Triplets,1974.0,https://leetcode.com/problems/number-of-single-divisor-triplets/,,math
"Feb. 27, 2022",2184,Number of Ways to Build Sturdy Brick Wall,1913.0,https://leetcode.com/problems/number-of-ways-to-build-sturdy-brick-wall/,,"array, bit manipulation, bitmask, dynamic programming"
"Feb. 5, 2022",2158,Amount of New Area Painted Each Day,1901.0,https://leetcode.com/problems/amount-of-new-area-painted-each-day/,,"array, ordered set, segment tree"
"Jan. 22, 2022",2147,Number of Ways to Divide a Long Corridor,1918.0,https://leetcode.com/problems/number-of-ways-to-divide-a-long-corridor/,Biweekly Contest 70,"dynamic programming, math, string"
"Dec. 19, 2021",2111,Minimum Operations to Make the Array K-Increasing,1953.0,https://leetcode.com/problems/minimum-operations-to-make-the-array-k-increasing/,Weekly Contest 272,"array, binary search"
"Nov. 21, 2021",2077,Paths in Maze That Lead to Same Room,1933.0,https://leetcode.com/problems/paths-in-maze-that-lead-to-same-room/,,graph
"Nov. 13, 2021",2069,Walking Robot Simulation II,1918.0,https://leetcode.com/problems/walking-robot-simulation-ii/,Biweekly Contest 65,"design, simulation"
"Oct. 30, 2021",2055,Plates Between Candles,1929.0,https://leetcode.com/problems/plates-between-candles/,Biweekly Contest 64,"array, binary search, prefix sum, string"
"Sept. 26, 2021",2018,Check if Word Can Be Placed In Crossword,1955.0,https://leetcode.com/problems/check-if-word-can-be-placed-in-crossword/,Weekly Contest 260,"array, enumeration, matrix"
"Sept. 26, 2021",2015,Average Height of Buildings in Each Segment,1952.0,https://leetcode.com/problems/average-height-of-buildings-in-each-segment/,,"array, greedy, heap (priority queue), sorting"
"Aug. 29, 2021",1983,Widest Pair of Indices With Equal Range Sum,1997.0,https://leetcode.com/problems/widest-pair-of-indices-with-equal-range-sum/,,"array, hash table, prefix sum"
"Aug. 22, 2021",1981,Minimize the Difference Between T…arget and Chosen Elements,1994.0,https://leetcode.com/problems/minimize-the-difference-between-target-and-chosen-elements/,Weekly Contest 255,"array, dynamic programming, matrix"
"Aug. 15, 2021",1969,Minimum Non-Zero Product of the Array Elements,1972.0,https://leetcode.com/problems/minimum-non-zero-product-of-the-array-elements/,Weekly Contest 254,"greedy, math, recursion"
"Aug. 15, 2021",1966,Binary Searchable Numbers in an Unsorted Array,1909.0,https://leetcode.com/problems/binary-searchable-numbers-in-an-unsorted-array/,,"array, binary search"
"Aug. 8, 2021",1964,Find the Longest Valid Obstacl…e Course at Each Position,1946.0,https://leetcode.com/problems/find-the-longest-valid-obstacle-course-at-each-position/,Weekly Contest 253,"array, binary indexed tree, binary search"
"July 24, 2021",1943,Describe the Painting,1989.0,https://leetcode.com/problems/describe-the-painting/,Biweekly Contest 57,"array, hash table, prefix sum, sorting"
"July 4, 2021",1918,Kth Smallest Subarray Sum,1993.0,https://leetcode.com/problems/kth-smallest-subarray-sum/,,"array, binary search, sliding window"
"June 13, 2021",1898,Maximum Number of Removable Characters,1915.0,https://leetcode.com/problems/maximum-number-of-removable-characters/,Weekly Contest 245,"array, binary search, string, two pointers"
"May 29, 2021",1878,Get Biggest Three Rhombus Sums in a Grid,1900.0,https://leetcode.com/problems/get-biggest-three-rhombus-sums-in-a-grid/,Biweekly Contest 53,"array, heap (priority queue), math, matrix, prefix sum, sorting"
"May 23, 2021",1871,Jump Game VII,1954.0,https://leetcode.com/problems/jump-game-vii/,Weekly Contest 242,"dynamic programming, prefix sum, sliding window, string"
"April 4, 2021",1818,Minimum Absolute Sum Difference,1943.0,https://leetcode.com/problems/minimum-absolute-sum-difference/,Weekly Contest 235,"array, binary search, ordered set, sorting"
"March 21, 2021",1802,Maximum Value at a Given Index in a Bounded Array,1942.0,https://leetcode.com/problems/maximum-value-at-a-given-index-in-a-bounded-array/,Weekly Contest 233,"binary search, greedy"
"March 20, 2021",1798,Maximum Number of Consecutive Values You Can Make,1913.0,https://leetcode.com/problems/maximum-number-of-consecutive-values-you-can-make/,Biweekly Contest 48,"array, greedy, sorting"
"March 20, 2021",1794,Count Pairs of Equal Substring…s With Minimum Difference,1920.0,https://leetcode.com/problems/count-pairs-of-equal-substrings-with-minimum-difference/,,"greedy, hash table, string"
"March 14, 2021",1793,Maximum Score of a Good Subarray,1954.0,https://leetcode.com/problems/maximum-score-of-a-good-subarray/,Weekly Contest 232,"array, binary search, monotonic stack, stack, two pointers"
"Feb. 14, 2021",1760,Minimum Limit of Balls in a Bag,1944.0,https://leetcode.com/problems/minimum-limit-of-balls-in-a-bag/,Weekly Contest 228,"array, binary search"
"Jan. 31, 2021",1745,Palindrome Partitioning IV,1932.0,https://leetcode.com/problems/palindrome-partitioning-iv/,Weekly Contest 226,"dynamic programming, string"
"Jan. 24, 2021",1737,Change Minimum Characters to Satisf…y One of Three Conditions,1974.0,https://leetcode.com/problems/change-minimum-characters-to-satisfy-one-of-three-conditions/,Weekly Contest 225,"counting, hash table, prefix sum, string"
"Jan. 17, 2021",1727,Largest Submatrix With Rearrangements,1935.0,https://leetcode.com/problems/largest-submatrix-with-rearrangements/,Weekly Contest 224,"array, greedy, matrix, sorting"
"Dec. 27, 2020",1705,Maximum Number of Eaten Apples,1933.0,https://leetcode.com/problems/maximum-number-of-eaten-apples/,Weekly Contest 221,"array, greedy, heap (priority queue)"
"Dec. 20, 2020",1696,Jump Game VI,1953.0,https://leetcode.com/problems/jump-game-vi/,Weekly Contest 220,"array, dynamic programming, heap (priority queue), monotonic queue, queue"
"Dec. 13, 2020",1690,Stone Game VII,1961.0,https://leetcode.com/problems/stone-game-vii/,Weekly Contest 219,"array, dynamic programming, game theory, math"
"Dec. 12, 2020",1682,Longest Palindromic Subsequence II,1946.0,https://leetcode.com/problems/longest-palindromic-subsequence-ii/,,"dynamic programming, string"
"Nov. 22, 2020",1665,Minimum Initial Energy to Finish Tasks,1904.0,https://leetcode.com/problems/minimum-initial-energy-to-finish-tasks/,Weekly Contest 216,"array, greedy, sorting"
"Nov. 1, 2020",1642,Furthest Building You Can Reach,1950.0,https://leetcode.com/problems/furthest-building-you-can-reach/,Weekly Contest 213,"array, greedy, heap (priority queue)"
"Oct. 25, 2020",1631,Path With Minimum Effort,1937.0,https://leetcode.com/problems/path-with-minimum-effort/,Weekly Contest 212,"array, binary search, breadth-first search, depth-first search, heap (priority queue), matrix, union find"
"Oct. 18, 2020",1625,Lexicographically Smallest String …After Applying Operations,1997.0,https://leetcode.com/problems/lexicographically-smallest-string-after-applying-operations/,Weekly Contest 211,"breadth-first search, depth-first search, enumeration, string"
"Sept. 5, 2020",1574,Shortest Subarray to be Rem…oved to Make Array Sorted,1925.0,https://leetcode.com/problems/shortest-subarray-to-be-removed-to-make-array-sorted/,Biweekly Contest 34,"array, binary search, monotonic stack, stack, two pointers"
"Aug. 23, 2020",1562,Find Latest Group of Size M,1919.0,https://leetcode.com/problems/find-latest-group-of-size-m/,Weekly Contest 203,"array, binary search, simulation"
"Aug. 16, 2020",1552,Magnetic Force Between Two Balls,1925.0,https://leetcode.com/problems/magnetic-force-between-two-balls/,Weekly Contest 202,"array, binary search, sorting"
"Aug. 8, 2020",1538,Guess the Majority in a Hidden Array,1911.0,https://leetcode.com/problems/guess-the-majority-in-a-hidden-array/,,"array, interactive, math"
"Aug. 2, 2020",1537,Get the Maximum Score,1968.0,https://leetcode.com/problems/get-the-maximum-score/,Weekly Contest 200,"array, dynamic programming, greedy, two pointers"
